question,answer
Grade point average (gpa),"A given session. It is based on the program code/version and all the courses the student took that are part of the program, including electivesgrade point average - calculationthe session grade point average and/or the program grade point average will be displayed on the transcript/achievement record and calculated as follows:the enrolled course must have a credit value.the grade scale associated to the course must be included in the gpa calculation.(pass/fail courses are not included.)alpha grades not"
Grade point average (gpa),"Assigned a grade point value (au and dna) do not have a grade point value)transfer credits are not included in the calculation of gpa.the grades of i/p (in process) and i (incomplete) are not included in the gpa calculations.if a course is repeated (including equivalencies) the most recent grade will always be used to compute the program gpa. If the first course taken is a failure and the same course is repeated (including equivalencies) and it is a failure, only one failure will be used in the calculation"
Grade point average (gpa),Of the gpa.course failures associated to an enrolment status of pla will not be included in any gpa calculation.use of grade point averagethe program/cohort gpa may be used to determine the academic standing and academic awards.
Academic standing decisions,Academic decisions are based on a student’s academic achievement with respect to the promotion standards of the program of study. Academic decisions are entered on the student's permanent academic record and will appear on the transcript. Progress from one level to the next is dependent upon successful completion of courses and/or meeting program promotion standards.students are informed in advance of the standards which will determine successful progression through the program of study to program
Academic standing decisions,"Completion. Students who require longer than the designed program duration to complete their studies are accountable for completing any new and/or additional courses or program requirements that may result due to changes in the program of study. In such cases, the chair of the program may grant exemptions where it is deemed appropriate.based on a student's academic achievement and following the promotion guidelines of the program, an academic standing decision is assigned to the student record indicating"
Academic standing decisions,"Progress/promotion/graduation.graduateallowed to graduate.met requirementsmet requirements of program.eligible to continuepromoted to the next academic level of the program.special timetable - same levelnot promoted, or allowed to graduate due to missing/failed course(s). However, student is allowed to return to the program to repeat/complete missing/failed course(s).academic probationpromoted to next level with a special timetable and academic conditions.decision pendinga temporary decision, pending"
Academic standing decisions,Receipt of final marks.discontinued (formerly college withdrawal)initiated by the college due to the student’s failure to meet program objectives.required to withdrawcollege initiated termination of studies due to non-academic performance.
Academic appeals,"Conestoga has established procedures to deal with academic appeals in an effective, timely, fair, and impartial manner. Before submitting an appeal, please review theacademic dispute resolution and appeal procedure (pdf)to familiarize yourself with the necessary appeal steps and criteria.how to submit an appeal*effective april 15, 2024full-time studentsfor appeals at step 1, complete this step by email to the appropriate faculty member.for appeals at step 2 or higher, complete these steps using theacademic"
Academic appeals,"Appeal requestfound on thestudent portalunder “my services"" > ""my forms"". Once you select your appeal type, the request form will automatically guide you through the steps.part-time studentsfor appeals at step 1, 2 or 3, complete these steps by email to the appropriate faculty member, chair, or dean. When submitting an appeal by email, please refer to the appeal criteria and attach all relevant documentation.for appeals at step 4, complete this step by email toappeals@conestogac.on.ca.supportif you require"
Academic appeals,"Assistance with the academic appeal request process, you can request support from a csi student advocate. Visitacademic appealson the csi website."
Student achievement report,"The student achievement report includes an academic standing decision and all courses with or without a formal assessment component. These reports are available at the end of each session via the student portal or those with decisions other than ""eligible to continue"" will be issued/mailed by the registrar's office. Marks are considered confidential information and, therefore, are not given out over the telephone under any circumstances. When inquiring about achievement, the student identification number"
Student achievement report,Must be provided.
Requesting a transcript,"Note: allow at least two weeks for processing. Official transcripts will not be issued to students with outstanding tuition, residence or incidental fees.request a transcript for your ocas or ouac applicationif you are applying online to college (www.ontariocolleges.ca)oruniversity (www.ouac.on.ca) and are currently attending or previously attended an ontario college or university; to have your transcript transferred, you must complete the online ontariocolleges.ca or ouac transcript request form.request a"
Requesting a transcript,"Transcriptthe registrar's office uses mycredstmto issue digital transcripts.mycredsis a digital wallet that provides secure access to your academic credentials that you can share with colleges, universities, employers, immigration authorities, and other third parties. Please visit mycreds.ca for answers tofrequently asked questions.when your academic status in a program is updated to ""graduate"", your digital credential (parchment) and transcript will be automatically uploaded and available through mycreds"
Requesting a transcript,"Within 24-48 hours. A notification will be sent to your conestoga email address with information on how to set up an account. Be sure to link your personal email address so that you never lose access to your records.for a general transcript request where a status of ""graduate"" is not applicable, please follow the steps below:full-time students:log in to thestudent portaland complete the request for transcript form. Select the “services” tab, then select the “my forms” button.continuing education students,"
Requesting a transcript,"Former students, and alumni:complete thisrequest for transcriptform.when your request for transcript form has been processed and your digital transcript is available, you will receive an email from mycreds. Follow the instructions in the email to register and create your mycredsaccount.to share your transcripts with a third party, you need to purchase ‘share credits’ on themycreds learner portalusing a valid credit card. One share requires one share credit.mycreds faqwhat information is on the official"
Requesting a transcript,"Transcript?an official transcript contains your academic achievements and bears official signatures and conestoga college crest.how does mycreds™ secure my official digital transcript?when shared through the mycreds platform, the official transcript is authentic, tamper-evident and legally valid. Documents issued through mycreds contain digital signatures that meet the legal requirements of certified digital documents in countries around the world. When you share your documents with third parties through"
Requesting a transcript,"The mycreds portal, these digital signatures ensure their authenticity.mycreds stores your documents securely with your data remaining under conestoga college’s control. You control who you share your documents with. The underlying mycreds systems have been independently tested by security experts.how do i log in to the mycreds learner portal?if you have the email notification you received from mycreds when the document was issued: follow the link in the email notification and log in with your username and"
Requesting a transcript,"Password. If you have not yet created an account, it will prompt you to do so.if you no longer have the email notification you received from mycreds: from thesign inpage, selectsign in with your education provider. From the institution drop-down menu, selectconestoga college. Next, log in with your username and password. You must have already created an account to access the system without the email link.what email address will mycreds use to send notifications?all mycreds notifications for current students"
Requesting a transcript,"And recent graduates will be sent to yourconestoga college email address.if you are a former student and/or you no longer have an active conestoga college email account, the notification will be sent to the email address you include in your request.how do i share my digital transcript?once you receive the confirmation email that your digital transcript is available, simply follow the link provided to log in to your secure account on the mycreds learner portal. Don’t forget to check your junk folder if you"
Requesting a transcript,"Don’t see the email in your inbox.after logging in, purchase the number of required ‘share credits’ by clicking on theadd morelink. You will need one share credit for each email address you are sharing your transcript with.from thedocumentspage, which will be displayed after login, click on thesharebutton next to the document you wish to share. You will enter the recipient email address and mycreds will send an email to the person or organization. You can specify for how long they can access the document,"
Requesting a transcript,"Or require them to have a pin to access the document.this document sharing screen is where you will enter the recipient email address. Once you have entered the email address, click thecontinuebutton.review the number of share credits you have for this document, and clickshare.review the confirmation message which will include the email address for the recipient you have shared your transcript with. You can advise the recipient to expect an email notification frommycreds.ca|mes certif.ca"
Requesting a transcript,"<noreply@mycreds.ca>.for complete details about sharing your documents, please see themycreds learner faq.what are share credits?instead of paying a fee per paper transcript, with the digital transcript you will purchase a specific number of ‘share credits’ for that document on the mycreds learner portal. Each share credit will allow you to share the secure digital transcript with one recipient, such as an employer or an educational institution. A valid credit card is required to purchase share credits. For"
Requesting a transcript,"Example, if you need to send transcripts to both a regulatory board and your employer, you will need to purchase two share credits from the mycreds portal. In the mycreds learner portal, you will be able to see how many share credits you purchased, how many you have already used, and how many are remaining.what is the cost of a digital transcript?the cost for each digital transcript share credit is $12 plus tax. Transcript fees are charged in canadian dollars and can be paid by using visa, mastercard, apple"
Requesting a transcript,"Pay and google pay. Payments are non-refundable.how can i download my digital transcript as a pdf?your digital transcript is not available for download from the documents page in your mycreds learner portal. This is one of the ways that the office of the registrar ensures the integrity of academic records for employers, government authorities and other verifiers. When you share the document with a third-party recipient directly through the mycreds platform, the recipient can verify that the document is"
Requesting a transcript,"Authentic and current and will have access to the transcript in pdf format which they will be able to download and retain for their record-keeping purposes.as a learner, if you need a copy of your official transcript for your own records, simply share the document with yourself by entering your own email address. This will then allow you to access and download the pdf. This option will use up one share credit. If you also need to share the document securely with another third party within the platform, you"
Requesting a transcript,Will need to purchase additional share credits. Seehow do i share my digital transcript?above for step-by-step instructions.need more help? visitmycreds learner faqor contactstudentrecords@conestogac.on.ca.
Academic credentials / documents of recognition,"Depending on the program, the official documents awarded by the board of governors in recognition of successful completion of a program are:certificateontario college certificatebaccalaureate degreeontario college advanced diplomaontario college diplomaontario college graduate certificateadditional information on academic policies and procedures may be found atour policies website.affirmationan affirmation for courses with a formal assessment component may be obtained by completing thegeneral request"
Academic credentials / documents of recognition,Form(pdf) and submitting to the registrar’s office with the applicable fee. This document is suitable for framing.statement of participationa statement of participation indicates the student's attendance and participation in a course in which there is no formal assessment (provided the course is eligible) and may be obtained by completing thegeneral request form(pdf) and submitting to the registrar's office with the applicable fee. This document is suitable for framing.certificate of achievementawarded by
Academic credentials / documents of recognition,"The office of the registrar to students who have successfully completed outcomes of a prescribed program; typically less than 180 hours in duration. This certificate will include the logo and seal of the conestoga and will be signed by the registrar.recognition of learningthis document is awarded by the program team in order to recognize learning that does not qualify for a credential/document as outlined in the definitions above.document replacementif a duplicate copy of a document is required, the request"
Academic credentials / documents of recognition,"Must be made in writing to the registrar's office. Ageneral request form(pdf) is available for this purpose. Documents that can be requested are certificates, ontario college certificates, ontario college diplomas, ontario college advanced diplomas, ontario college graduate certificate, applied degrees, affirmations and statements of participation. Applicable fees apply."
Convocation,"Official graduation ceremonies take place in february, june, and november and feature the presentation of diplomas, certificates, degrees, and special college-wide awards.to be eligible to participate, the student must have successfully completed all program requirements by a specific date (which permits the registrar’s office to process your records) and the program must qualify for participation in the ceremonies. If program requirements are not completed until after the date set, the student would be"
Convocation,"Eligible to participate in the next scheduled convocation.information on convocation is mailed to all potential graduates. To attend the ceremony, students must register their attendance through the student portal.note:in programs where an academic standing decision of ""met requirements"" is assigned upon completion of the program, the students are not eligible to participate in the convocation ceremony.application to graduateif a student is not registered in a full-time program, and is completing the final"
Convocation,"Course(s) of the program on a part-time basis, theapplication to graduate form(pdf) must be completed and submitted to the registrar's office. Applicable fee will apply."
Privacy information,"Conestoga is committed to respecting your privacy and protecting your personal information. In accordance with section 39(2) of thefreedom of information and protection of privacy act, r.s.o. 1990, c. F.31, this is to advise you that your personal information is collected under the legal authority of theontario colleges of applied arts and technology act, 2002, and may be used and/or disclosed for administrative, statistical and/or research purposes of the college and/or ministries and agencies of the"
Privacy information,"Government of ontario and the government of canada, including, but not limited to, tabulating and reporting data on key performance indicators (graduation rate, graduate employment, graduate satisfaction and employer satisfaction). You may also be contacted by ministry- or college-authorized third parties for your voluntary participation in surveys to evaluate student and graduate experiences and outcomes.conestoga college is required to disclose personal information such as ontario education numbers,"
Privacy information,"Student characteristics and educational outcomes to the minister of training, colleges and universities under s. 15 of the ministry of training, colleges and universities act, r.s.o. 1990, chapter m.19, as amended. The ministry collects this data for purposes such as planning, allocating and administering public funding to colleges, universities and other post-secondary educational and training institutions and to conduct research and analysis, including longitudinal studies, and statistical activities"
Privacy information,"Conducted by or on behalf of the ministry for purposes that relate to post-secondary education and training. Further information on how the minister of training, colleges and universities uses this personal information is available on the ministry’s website.further information on the collection and use of student-level enrolment-related data can be obtained from the ministry of training, colleges and universities website or by writing to:director, postsecondary finance and information management"
Privacy information,"Branch,postsecondary education division, 7th floor, mowat block900 bay streettoronto, on, m7a 1l2"
Statistics canada notice,"Notification of disclosure of personal information to statistics canadastatistics canada is the national statistical agency. As such, statistics canada carries out hundreds of surveys each year on a wide range of matters, including education.it is essential to be able to follow students across time and institutions to understand, for example, the factors affecting enrolment demand at postsecondary institutions. The increased emphasis on accountability for public investment means that it is also important to"
Statistics canada notice,"Understand ‘outcomes’. In order to conduct such studies, statistics canada asks all colleges and universities to provide data on students and graduates. Institutions collect and provide to statistics canada, student identification information (student’s name, student id number, social insurance number), student contact information (address and telephone number), student demographic characteristics, enrolment information, previous education, and labour force activity.the federal statistics act provides the"
Statistics canada notice,"Legal authority for statistics canada to obtain access to personal information held by educational institutions. The information may be used for statistical purposes only, and the confidentiality provisions of the statistics act prevent the information from being released in any way that would identify a student.students who do not wish to have their information used can ask statistics canada to remove their identifying information from the national database. On request by a student, statistics canada will"
Statistics canada notice,"Delete an individual’s contact information (name, address, or other personal identifiers) from the psis database. To make such a request, please contact us:via telephone:monday to friday8:30 a.m. To 4:30 p.m. Et1-800-307-3382 or1-613-951-7608via mail:institutional surveys sectioncentre for education statisticsstatistics canada, main building, sc 2100-ktunney’s pasture, ottawa, on k1a 0t6via e-mail:psis-siep_contact@statcan.gc.castatistics canada maintains a recommended standard disclosure notice for"
Statistics canada notice,Reporting to statistics canada’s postsecondary student information system (psis) on thepsis website
Freedom of information,"Under current provincial law, a student’s records are considered confidential and will be released to a third party only upon the written authorization of the student or by exception as noted under the release of information section of this guide. Information collected in student records will be used to administer the programs and activities of the college. While student records are the property of the college, students have the right to view their own records upon request. Student records may include"
Freedom of information,"Personal, academic and non-academic information (for example, identification photographs)."
General information,"The term “student record” refers to the collection of data dealing with an individual who is associated with a program or course of study at the college. Most of the data is categorized as academic, personal and/or financial and is maintained by the registrar’s office. The official college record for each student is a permanent record consisting minimally of the student’s name, student number, personal data, achievement, and academic decisions and should be maintained for a minimum of 55 years.academic"
General information,"Record: consists of academic activity (program/course registration, achievement, transfer credits and academic standing) at the college.personal record:consists of biographical data and may include previous educational achievements such as secondary school records. Please ensure that the address in the registrar’s system is the correct one for mailing purposes. Contact the registrar’s office to request a personal data information change form to change your address or update other personal data on your"
General information,"Student record.financial record:consists of financial transactions with the college relating specifically to tuition and incidental fees.accuracy of the student record:the student is personally responsible for the completeness and accuracy of their student record, which is maintained by the registrar’s office. This includes mailing address, personal data and achievement. It is also the responsibility of the student to ensure that their program requirements are being met."
Who do i contact if i have an emergency or safety concern?,"If you feel unsafe or require immediate attention, contactsafety and securityfor support on campus. If you are off campus, contact emergency services by calling 911."
Where do i find information on mental health and wellness supports?,"Conestoga offerscounselling,peer supportandmedical careto assist students with mental health and wellness.for after-hours mental health support, please contactgood2talk- a free 24-hour service for ontario post-secondary students.if you are in crisison campus, contactsafety and securityfor support. If you are in crisisoff campus, contact emergency services by calling 911."
Where do i find information on sexual and gender-based violence supports?,"If you have experienced or witnessed sexual or gender-based violence and would like to discuss supports available both on and off campus, please contact thesexual and gender-based violence coordinator. They can answer questions regardingsexual assault and sexual violence policies and procedures, including your reporting options."
Who can report a student rights and responsibilities violation?,"College students, employees and members of the public may submit reports on behalf of themselves or someone else."
How and when do i report a student rights and responsibilities violation?,"If a concern continues, escalates, or informal resolution is not appropriate, you may decide to make a report to the srro. You can make a verbal report bycontacting usor use thereport formto report an incident in& writing. We will respond within two business days to arrange a time to discuss the incident and gather more information."
I have been reported for a student rights and responsibilities violation. What happens next?,"If you have received notice from the srro or safety and security of a report regarding your conduct, it is important to understand how the process works. Refer to the information onformal resolutionand thestudent rights and responsibilities procedure(pdf).contact uswith any questions."
Who do i contact if i have academic concerns?,"Each program area has a student success advisor (ssa) who is available to help you address academic issues and connect you to services. If you are unsure who your ssa is, complete theself-referral formto ask for help.for details on individual services and other important academic contacts, refer to your program handbook found under the more info tab on yourfull-time programpage."
"How do i dispute a grade, academic decision or academic integrity penalty?","Follow theacademic dispute resolution and appeal procedure(pdf). Speak with the faculty first about your concern. If your concern is still unresolved, contact the program chair to review the decision and determine the next step.if you need help navigating this process:contact your program area's student success advisor (ssa). If you are unsure who your ssa is, complete theself-referral formto ask for help, orcontactconestoga students inc., your official student association, for help with this process and"
